{
  "episode_index": 7,
  "repo_id": "scout/earth-rover-mini-20260619",
  "fps": 4,
  "task": "go to the doorway",
  "model_id": "claude",
  "system": "You are scout, a friendly Earth Rover Mini sidewalk robot.",
  "tools": [
    {"name": "rover_see", "description": "Capture the front camera.", "input_schema": {"type": "object", "properties": {"camera": {"type": "string"}}}},
    {"name": "rover_move", "description": "Drive linear/angular for duration seconds.", "input_schema": {"type": "object", "properties": {"linear": {"type": "number"}, "angular": {"type": "number"}, "duration": {"type": "number"}}}}
  ],
  "messages": [
    {"role": "user", "content": "@cagatay (telegram): go to the doorway",
     "_meta": {"agent_id": "telegram", "frame_index": 0, "t": 0.0}},
    {"role": "assistant", "content": "Doorway is ahead-left; I'll look first.",
     "tool_calls": [{"id": "tu_1", "type": "function", "function": {"name": "rover_see", "arguments": "{\"camera\": \"front\"}"}}],
     "_meta": {"agent_id": "main", "frame_index": 1, "t": 0.3}},
    {"role": "tool", "tool_call_id": "tu_1", "content": "[front] observation.images.front#frame=1",
     "_meta": {"agent_id": "main", "frame_index": 1, "t": 0.3}},
    {"role": "assistant", "content": "Clear path. Driving forward.",
     "tool_calls": [{"id": "tu_2", "type": "function", "function": {"name": "rover_move", "arguments": "{\"linear\": 0.3, \"angular\": 0.1, \"duration\": 2}"}}],
     "_meta": {"agent_id": "main", "frame_index": 2, "t": 0.6, "frame_span": [2, 10]}},
    {"role": "tool", "tool_call_id": "tu_2", "content": "Moved linear=0.3 angular=0.1 for 2s. observation.images.front#frame=10",
     "_meta": {"agent_id": "main", "frame_index": 10, "frame_span": [2, 10]}}
  ],
  "action_chunks": [
    {"tool_use_id": "tu_2", "frames": [2, 10],
     "actions": [[0.3, 0.1, 0.0], [0.3, 0.1, 0.0], [0.3, 0.1, 0.0], [0.3, 0.1, 0.0], [0.3, 0.1, 0.0], [0.3, 0.1, 0.0], [0.3, 0.1, 0.0], [0.3, 0.1, 0.0], [0.3, 0.1, 0.0]]}
  ]
}
